{
  "$schema": "http://json-schema.org/draft-07/schema#",
  "title": "Generated schema for Root",
  "type": "array",
  "items": {
    "type": "object",
    "properties": {
      "severity": {
        "type": "string"
      },
      "file": {
        "type": "string"
      },
      "issue": {
        "type": "string"
      },
      "suggestion": {
        "type": "string"
      }
    },
    "required": [
      "severity",
      "file",
      "issue",
      "suggestion"
    ]
  }
}
